{
  "schema": "oaax-manifest/1",
  "oaax_version": "2.0",
  "model_file": "model.onnx",
  "precision": "FP32",
  "equivalent": false,
  "inputs": [
    {
      "name": "image-",
      "onnx": {
        "dtype": "FLOAT",
        "shape": [
          1,
          3,
          240,
          320
        ],
        "layout": "NCHW"
      },
      "native": {
        "dtype": "FLOAT",
        "shape": [
          1,
          3,
          240,
          320
        ],
        "layout": "NCHW"
      }
    },
    {
      "name": "nms_sensitivity-",
      "onnx": {
        "dtype": "FLOAT",
        "shape": [
          1
        ],
        "layout": "X"
      },
      "native": {
        "dtype": "FLOAT",
        "shape": [
          1
        ],
        "layout": "X"
      }
    }
  ],
  "outputs": [
    {
      "name": "bbox_0",
      "native": {
        "dtype": "FLOAT",
        "shape": [
          1,
          64,
          30,
          40
        ],
        "layout": "NCHW"
      }
    }
  ]
}