{
  "schema": "oaax-manifest/1",
  "oaax_version": "2.0",
  "model_file": "model.onnx",
  "precision": "INT8",
  "equivalent": true,
  "inputs": [
    {
      "name": "image-",
      "onnx": {
        "dtype": "FLOAT",
        "shape": [
          1,
          3,
          240,
          320
        ],
        "layout": "NCHW"
      },
      "native": {
        "dtype": "UINT8",
        "shape": [
          1,
          240,
          320,
          3
        ],
        "layout": "NHWC",
        "quantization": {
          "scale": 1.0,
          "zero_point": 0
        }
      }
    },
    {
      "name": "nms_sensitivity-",
      "onnx": {
        "dtype": "FLOAT",
        "shape": [
          1
        ],
        "layout": "X"
      },
      "native": {
        "dtype": "FLOAT",
        "shape": [
          1
        ],
        "layout": "X"
      }
    }
  ],
  "outputs": [
    {
      "name": "bboxes-format:xyxysc;0:face",
      "onnx": {
        "dtype": "FLOAT",
        "shape": [
          20,
          6
        ],
        "layout": "XX"
      },
      "native": {
        "dtype": "FLOAT",
        "shape": [
          20,
          6
        ],
        "layout": "XX"
      }
    }
  ],
  "toolchain": {
    "name": "example",
    "version": "1.0"
  }
}